[
  {"id":"grandfathers_camera","name":"Grandfather's camera","compatibility":{"settings":["modern"],"eras":["modern"],"species":["human"],"life_stages":["teen","young_adult","adult","mature","older"],"countries":[]},"metadata":{"linked_hobbies":["photography"],"origin":"Inherited from a grandfather","meaning":"A reminder to pay attention","visual_importance":"high"}},
  {"id":"broken_pocket_watch","name":"Broken pocket watch","compatibility":{"settings":[],"eras":[],"species":[],"life_stages":["teen","young_adult","adult","mature","older"],"countries":[]},"metadata":{"origin":"A family keepsake","meaning":"Unfinished family business","visual_importance":"medium"}},
  {"id":"annotated_recipe_book","name":"Heavily annotated recipe book","compatibility":{"settings":[],"eras":[],"species":[],"life_stages":["teen","young_adult","adult","mature","older"],"countries":[]},"metadata":{"linked_hobbies":["cooking"],"origin":"Built across years of shared meals","meaning":"Memory through food","visual_importance":"medium"}}
  ,{"id":"painted_stone","name":"A small hand-painted stone","compatibility":{"settings":[],"eras":[],"species":[],"life_stages":["child","teen"],"countries":[]},"metadata":{"origin":"A gift from a childhood friend","meaning":"A promise to stay curious","visual_importance":"small"}},
  {"id":"chipped_compass","name":"A chipped brass compass","compatibility":{"settings":["modern","fantasy"],"eras":[],"species":[],"life_stages":["teen","young_adult","adult","mature","older"],"countries":[]},"metadata":{"linked_hobbies":["birdwatching","urban_sketching"],"origin":"Recovered during a formative journey","meaning":"Direction can be chosen","visual_importance":"medium"}},
  {"id":"handmade_clay_cup","name":"An uneven handmade clay cup","compatibility":{"settings":[],"eras":[],"species":[],"life_stages":["teen","young_adult","adult","mature","older"],"countries":[]},"metadata":{"linked_hobbies":["pottery"],"origin":"The first piece they kept","meaning":"Progress over perfection","visual_importance":"medium"}},
  {"id":"pressed_leaf_journal","name":"A field journal filled with pressed leaves","compatibility":{"settings":[],"eras":[],"species":[],"life_stages":["teen","young_adult","adult","mature","older"],"countries":[]},"metadata":{"linked_hobbies":["gardening","herbalism","birdwatching"],"origin":"Built page by page during solitary walks","meaning":"Attention creates belonging","visual_importance":"high"}},
  {"id":"carved_wooden_bird","name":"A palm-sized carved wooden bird","compatibility":{"settings":["modern","fantasy"],"eras":[],"species":[],"life_stages":[],"countries":[]},"metadata":{"linked_hobbies":["woodcarving","birdwatching"],"origin":"Carved from a scrap with personal significance","meaning":"Patience and return","visual_importance":"medium"}},
  {"id":"creased_transit_map","name":"A heavily creased transit map covered in notes","compatibility":{"settings":["modern"],"eras":["modern"],"species":["human"],"life_stages":["teen","young_adult","adult","mature","older"],"countries":[]},"metadata":{"linked_hobbies":["urban_sketching","photography"],"origin":"Carried through years of exploring the city","meaning":"There is always another route","visual_importance":"medium"}},
  {"id":"patched_dance_shoes","name":"A carefully patched pair of dance shoes","compatibility":{"settings":["modern","fantasy"],"eras":[],"species":[],"life_stages":["teen","young_adult","adult","mature","older"],"countries":[]},"metadata":{"linked_hobbies":["dance"],"origin":"Saved from an important first performance","meaning":"Courage through movement","visual_importance":"high"}},
  {"id":"etched_star_chart","name":"A folding star chart etched on thin metal","compatibility":{"settings":["science_fiction"],"eras":["future"],"species":["human"],"life_stages":["teen","young_adult","adult","mature","older"],"countries":[]},"metadata":{"linked_hobbies":["stargazing"],"origin":"A navigation instructor's parting gift","meaning":"Home is a coordinate and a choice","visual_importance":"high"}},
  {"id":"obsolete_service_robot","name":"A palm-sized obsolete service robot","compatibility":{"settings":["science_fiction"],"eras":["future"],"species":["human"],"life_stages":["teen","young_adult","adult","mature","older"],"countries":[]},"metadata":{"linked_hobbies":["robotics","radio_restoration"],"origin":"Rebuilt from discarded habitat parts","meaning":"Nothing useful is truly obsolete","visual_importance":"high"}},
  {"id":"guild_token","name":"A worn guild token on a leather cord","compatibility":{"settings":["fantasy"],"eras":["medieval_inspired","timeless"],"species":[],"life_stages":["teen","young_adult","adult","mature","older"],"countries":[]},"metadata":{"linked_hobbies":["woodcarving","pottery"],"origin":"Awarded after a difficult apprenticeship","meaning":"Skill must serve others","visual_importance":"medium"}}
]
