[
  {"id":"photography","name":"Photography","compatibility":{"settings":["modern","science_fiction"],"eras":["modern","future"],"species":[],"life_stages":["teen","young_adult","adult","mature","older"],"countries":[]},"metadata":{"cluster":"visual_arts","category":"visual_arts","variant":"street_photography","physical_demand":"low","related_skills":["composition"]}},
  {"id":"cooking","name":"Cooking","compatibility":{"settings":[],"eras":[],"species":[],"life_stages":["teen","young_adult","adult","mature","older"],"countries":[]},"metadata":{"cluster":"culinary","category":"culinary","variant":"home_cooking","physical_demand":"low","related_skills":["meal_planning"]}},
  {"id":"boxing","name":"Boxing","compatibility":{"settings":["modern"],"eras":["modern"],"species":["human"],"life_stages":["teen","young_adult","adult","mature","older"],"countries":[]},"metadata":{"cluster":"combat_sport","physical_demand":"high","related_skills":["fitness"]}},
  {"id":"gardening","name":"Gardening","compatibility":{"settings":[],"eras":[],"species":[],"life_stages":[],"countries":[]},"metadata":{"cluster":"horticulture","physical_demand":"moderate","related_skills":["plant_care"]}},
  {"id":"radio_restoration","name":"Restoring old radios","compatibility":{"settings":["modern"],"eras":["modern"],"species":["human"],"life_stages":["young_adult","adult","mature","older"],"countries":[]},"metadata":{"cluster":"tinkering","related_skills":["electronics_repair"]}},
  {"id":"pottery","name":"Pottery","compatibility":{"settings":[],"eras":[],"species":[],"life_stages":["teen","young_adult","adult","mature","older"],"countries":[]},"metadata":{"cluster":"craft","physical_demand":"moderate","related_skills":["ceramic_forming"]}},
  {"id":"birdwatching","name":"Birdwatching","compatibility":{"settings":[],"eras":[],"species":[],"life_stages":[],"countries":[]},"metadata":{"cluster":"nature_observation","physical_demand":"low","related_skills":["species_identification"]}},
  {"id":"distance_running","name":"Distance running","compatibility":{"settings":["modern","science_fiction"],"eras":["modern","future"],"species":[],"life_stages":["teen","young_adult","adult","mature","older"],"countries":[]},"metadata":{"cluster":"endurance_sport","physical_demand":"high","related_skills":["endurance_training"]}},
  {"id":"woodcarving","name":"Woodcarving","compatibility":{"settings":["modern","fantasy"],"eras":["modern","medieval_inspired","timeless"],"species":[],"life_stages":["teen","young_adult","adult","mature","older"],"countries":[]},"metadata":{"cluster":"craft","physical_demand":"low","related_skills":["carving"]}},
  {"id":"tabletop_games","name":"Tabletop games","compatibility":{"settings":[],"eras":[],"species":[],"life_stages":["teen","young_adult","adult","mature","older"],"countries":[]},"metadata":{"cluster":"social_games","physical_demand":"low","related_skills":["strategic_thinking"]}},
  {"id":"dance","name":"Social dance","compatibility":{"settings":[],"eras":[],"species":[],"life_stages":["teen","young_adult","adult","mature","older"],"countries":[]},"metadata":{"cluster":"performing_arts","physical_demand":"moderate","related_skills":["rhythm","partner_coordination"]}},
  {"id":"urban_sketching","name":"Urban sketching","compatibility":{"settings":["modern","science_fiction"],"eras":["modern","future"],"species":[],"life_stages":["teen","young_adult","adult","mature","older"],"countries":[]},"metadata":{"cluster":"visual_arts","physical_demand":"low","related_skills":["observational_drawing"]}},
  {"id":"stargazing","name":"Stargazing","compatibility":{"settings":[],"eras":[],"species":[],"life_stages":[],"countries":[]},"metadata":{"cluster":"nature_observation","physical_demand":"low","related_skills":["constellation_finding"]}},
  {"id":"robotics","name":"Building small robots","compatibility":{"settings":["modern","science_fiction"],"eras":["modern","future"],"species":["human"],"life_stages":["teen","young_adult","adult","mature","older"],"countries":[]},"metadata":{"cluster":"tinkering","physical_demand":"low","related_skills":["electronics","mechanical_design"]}},
  {"id":"herbalism","name":"Cultivating medicinal herbs","compatibility":{"settings":["fantasy"],"eras":["medieval_inspired","timeless"],"species":[],"life_stages":["teen","young_adult","adult","mature","older"],"countries":[]},"metadata":{"cluster":"horticulture","category":"horticulture","variant":"medicinal_gardening","physical_demand":"moderate","related_skills":["plant_lore"]}},
  {"id":"bread_baking","name":"Experimental bread baking","compatibility":{"settings":[],"eras":[],"species":[],"life_stages":["teen","young_adult","adult","mature","older"],"countries":[]},"metadata":{"cluster":"culinary","category":"culinary","variant":"sourdough","physical_demand":"low","related_skills":["fermentation"]}},
  {"id":"mapmaking","name":"Hand-drawn mapmaking","compatibility":{"settings":["fantasy","modern","science_fiction"],"eras":[],"species":[],"life_stages":["teen","young_adult","adult","mature","older"],"countries":[]},"metadata":{"cluster":"craft","category":"craft","variant":"cartography","physical_demand":"low","related_skills":["spatial_reasoning"]}},
  {"id":"amateur_astronomy","name":"Amateur astronomy","compatibility":{"settings":["modern","science_fiction"],"eras":["modern","future"],"species":[],"life_stages":["teen","young_adult","adult","mature","older"],"countries":[]},"metadata":{"cluster":"nature_observation","category":"science","variant":"deep_sky_observation","physical_demand":"low","related_skills":["star_navigation"]}},
  {"id":"community_theatre","name":"Community theatre","compatibility":{"settings":["modern","fantasy","science_fiction"],"eras":[],"species":[],"life_stages":["teen","young_adult","adult","mature","older"],"countries":[]},"metadata":{"cluster":"performing_arts","physical_demand":"moderate","related_skills":["improvisation","teamwork"]}},
  {"id":"oral_history","name":"Recording oral histories","compatibility":{"settings":["modern","science_fiction"],"eras":["modern","future"],"species":[],"life_stages":["teen","young_adult","adult","mature","older"],"countries":[]},"metadata":{"cluster":"community_history","physical_demand":"low","related_skills":["interviewing","archiving"]}},
  {"id":"kite_making","name":"Kite making","compatibility":{"settings":[],"eras":[],"species":[],"life_stages":["teen","young_adult","adult","mature","older"],"countries":[]},"metadata":{"cluster":"craft","physical_demand":"low","related_skills":["lightweight_construction"]}},
  {"id":"foraging","name":"Seasonal foraging","compatibility":{"settings":["modern","fantasy"],"eras":["modern","medieval_inspired","timeless"],"species":[],"life_stages":["teen","young_adult","adult","mature","older"],"countries":[]},"metadata":{"cluster":"outdoor_lore","physical_demand":"moderate","related_skills":["plant_identification"]}},
  {"id":"microgravity_dance","name":"Microgravity dance","compatibility":{"settings":["science_fiction"],"eras":["future"],"species":[],"life_stages":["teen","young_adult","adult","mature","older"],"countries":[]},"metadata":{"cluster":"performing_arts","physical_demand":"moderate","related_skills":["spatial_awareness"]}},
  {"id":"storytelling_circle","name":"Storytelling circles","compatibility":{"settings":["fantasy","modern","science_fiction"],"eras":[],"species":[],"life_stages":["teen","young_adult","adult","mature","older"],"countries":[]},"metadata":{"cluster":"social_arts","physical_demand":"low","related_skills":["narration","listening"]}}
]
