[
  {"id":"none","name":"No meaningful secret","compatibility":{"settings":[],"eras":[],"species":[],"life_stages":[],"countries":[]},"metadata":{"severity":"none"}},
  {"id":"unfinished_letter","name":"Keeps an unfinished apology letter","compatibility":{"settings":[],"eras":[],"species":[],"life_stages":["teen","young_adult","adult","mature","older"],"countries":[]},"metadata":{"severity":"personal"}},
  {"id":"quietly_in_debt","name":"Is quietly managing a debt","compatibility":{"settings":["modern"],"eras":["modern"],"species":["human"],"life_stages":["young_adult","adult","mature","older"],"countries":[]},"metadata":{"severity":"significant"}},
  {"id":"uses_false_surname","name":"Uses a surname that is not their own","compatibility":{"settings":[],"eras":[],"species":[],"life_stages":["young_adult","adult","mature","older"],"countries":[]},"metadata":{"severity":"significant"}},
  {"id":"abandoned_project","name":"Quietly abandoned a project others believe is still active","compatibility":{"settings":[],"eras":[],"species":[],"life_stages":["young_adult","adult","mature","older"],"countries":[]},"metadata":{"severity":"personal"}},
  {"id":"anonymous_benefactor","name":"Has been anonymously helping someone nearby","compatibility":{"settings":[],"eras":[],"species":[],"life_stages":["teen","young_adult","adult","mature","older"],"countries":[]},"metadata":{"severity":"personal"}},
  {"id":"hid_professional_error","name":"Once concealed a professional error with lasting consequences","compatibility":{"settings":[],"eras":[],"species":[],"life_stages":["young_adult","adult","mature","older"],"countries":[]},"metadata":{"severity":"significant"}},
  {"id":"lost_family_heirloom","name":"Lost a family heirloom and replaced it with a convincing copy","compatibility":{"settings":[],"eras":[],"species":[],"life_stages":["teen","young_adult","adult","mature","older"],"countries":[]},"metadata":{"severity":"personal"}},
  {"id":"secret_correspondence","name":"Maintains a secret correspondence with a former rival","compatibility":{"settings":[],"eras":[],"species":[],"life_stages":["teen","young_adult","adult","mature","older"],"countries":[]},"metadata":{"severity":"personal"}},
  {"id":"unclaimed_discovery","name":"Made an important discovery but never claimed credit","compatibility":{"settings":["fantasy","science_fiction"],"eras":[],"species":[],"life_stages":["young_adult","adult","mature","older"],"countries":[]},"metadata":{"severity":"significant"}},
  {"id":"forbidden_archive_copy","name":"Keeps a forbidden copy of an official archive","compatibility":{"settings":["fantasy","science_fiction"],"eras":[],"species":[],"life_stages":["young_adult","adult","mature","older"],"countries":[]},"metadata":{"severity":"significant"}},
  {"id":"plans_to_leave","name":"Plans to leave without telling the people who rely on them","compatibility":{"settings":[],"eras":[],"species":[],"life_stages":["teen","young_adult","adult","mature","older"],"countries":[]},"metadata":{"severity":"personal"}}
]
