[
  {"id":"minimal_smart_casual","name":"Minimalist smart-casual","compatibility":{"settings":["modern"],"eras":["modern"],"species":["human"],"life_stages":["young_adult","adult","mature","older"],"countries":[]},"metadata":{"formality":"medium","income_bands":["moderate","upper_middle","high"]}},
  {"id":"practical_layered","name":"Practical layered clothing","compatibility":{"settings":[],"eras":[],"species":[],"life_stages":[],"countries":[]},"metadata":{"formality":"casual"}},
  {"id":"subtle_streetwear","name":"Subtle streetwear","compatibility":{"settings":["modern"],"eras":["modern"],"species":["human"],"life_stages":["teen","young_adult","adult"],"countries":[]},"metadata":{"formality":"casual"}},
  {"id":"soft_academic","name":"Soft academic style","compatibility":{"settings":["modern","fantasy"],"eras":[],"species":[],"life_stages":["teen","young_adult","adult","mature"],"countries":[]},"metadata":{"formality":"medium"}},
  {"id":"relaxed_workwear","name":"Relaxed workwear","compatibility":{"settings":["modern"],"eras":["modern"],"species":["human"],"life_stages":["young_adult","adult","mature","older"],"countries":[]},"metadata":{"formality":"casual","income_bands":["low","lower_middle","moderate","upper_middle"]}},
  {"id":"colourful_vintage","name":"Colourful vintage-inspired style","compatibility":{"settings":["modern"],"eras":["modern"],"species":["human"],"life_stages":["teen","young_adult","adult","mature","older"],"countries":[]},"metadata":{"formality":"casual"}},
  {"id":"tailored_classic","name":"Tailored classic style","compatibility":{"settings":["modern"],"eras":["modern"],"species":["human"],"life_stages":["young_adult","adult","mature","older"],"countries":[]},"metadata":{"formality":"formal","income_bands":["moderate","upper_middle","high"]}},
  {"id":"outdoors_practical","name":"Weather-ready outdoor practical","compatibility":{"settings":["modern","fantasy"],"eras":[],"species":[],"life_stages":["teen","young_adult","adult","mature","older"],"countries":[]},"metadata":{"formality":"casual"}},
  {"id":"artisan_layers","name":"Textured artisan layers","compatibility":{"settings":["fantasy"],"eras":["medieval_inspired","timeless"],"species":[],"life_stages":["teen","young_adult","adult","mature","older"],"countries":[]},"metadata":{"formality":"casual"}},
  {"id":"courtly_understated","name":"Understated courtly dress","compatibility":{"settings":["fantasy"],"eras":["medieval_inspired","timeless"],"species":[],"life_stages":["young_adult","adult","mature","older"],"countries":[]},"metadata":{"formality":"formal","income_bands":["upper_middle","high"]}},
  {"id":"technical_minimalist","name":"Technical minimalist","compatibility":{"settings":["science_fiction"],"eras":["future"],"species":["human"],"life_stages":["teen","young_adult","adult","mature","older"],"countries":[]},"metadata":{"formality":"medium"}},
  {"id":"orbital_utility","name":"Orbital utility wear","compatibility":{"settings":["science_fiction"],"eras":["future"],"species":["human"],"life_stages":["teen","young_adult","adult","mature","older"],"countries":[]},"metadata":{"formality":"casual"}}
]
