[
  {"id":"accountant","name":"Accountant","compatibility":{"settings":["modern"],"eras":["modern"],"species":["human"],"life_stages":["young_adult","adult","mature","older"],"countries":[]},"metadata":{"education":["degree","professional_training"],"income_band":"moderate","role":"employed","category":"finance","specialisation":"audit"}},
  {"id":"librarian","name":"Librarian","compatibility":{"settings":["modern","fantasy"],"eras":["modern","medieval_inspired"],"species":[],"life_stages":["young_adult","adult","mature","older"],"countries":[]},"metadata":{"education":["degree"],"income_band":"lower_middle","role":"employed","category":"knowledge","specialisation":"archives"}},
  {"id":"software_developer","name":"Software Developer","compatibility":{"settings":["modern","science_fiction"],"eras":["modern","future"],"species":["human"],"life_stages":["young_adult","adult","mature","older"],"countries":[]},"metadata":{"education":["degree","self_taught"],"income_band":"upper_middle","role":"employed","technology_start":1960,"category":"technology","specialisation":"software"}},
  {"id":"healer","name":"Healer","compatibility":{"settings":["fantasy"],"eras":["medieval_inspired","timeless"],"species":[],"life_stages":["young_adult","adult","mature","older"],"countries":[]},"metadata":{"income_band":"moderate","role":"employed"}},
  {"id":"teacher","name":"Teacher","compatibility":{"settings":["modern","fantasy","science_fiction"],"eras":[],"species":[],"life_stages":["young_adult","adult","mature","older"],"countries":[]},"metadata":{"education":["degree","professional_training"],"income_band":"moderate","role":"employed"}},
  {"id":"paramedic","name":"Paramedic","compatibility":{"settings":["modern","science_fiction"],"eras":["modern","future"],"species":["human"],"life_stages":["young_adult","adult","mature"],"countries":[]},"metadata":{"education":["professional_training"],"income_band":"moderate","role":"employed","technology_start":1960}},
  {"id":"baker","name":"Baker","compatibility":{"settings":["modern","fantasy"],"eras":["modern","medieval_inspired","timeless"],"species":[],"life_stages":["young_adult","adult","mature","older"],"countries":[]},"metadata":{"education":["apprenticeship","self_taught"],"income_band":"lower_middle","role":"employed"}},
  {"id":"carpenter","name":"Carpenter","compatibility":{"settings":["modern","fantasy"],"eras":["modern","medieval_inspired","timeless"],"species":[],"life_stages":["young_adult","adult","mature","older"],"countries":[]},"metadata":{"education":["apprenticeship"],"income_band":"moderate","role":"employed"}},
  {"id":"journalist","name":"Journalist","compatibility":{"settings":["modern","science_fiction"],"eras":["modern","future"],"species":["human"],"life_stages":["young_adult","adult","mature","older"],"countries":[]},"metadata":{"education":["degree","self_taught"],"income_band":"moderate","role":"employed","technology_start":1700}},
  {"id":"museum_curator","name":"Museum Curator","compatibility":{"settings":["modern"],"eras":["modern"],"species":["human"],"life_stages":["young_adult","adult","mature","older"],"countries":[]},"metadata":{"education":["degree"],"income_band":"moderate","role":"employed"}},
  {"id":"ranger","name":"Wilderness Ranger","compatibility":{"settings":["modern","fantasy"],"eras":[],"species":[],"life_stages":["young_adult","adult","mature","older"],"countries":[]},"metadata":{"education":["professional_training","self_taught"],"income_band":"lower_middle","role":"employed"}},
  {"id":"starship_engineer","name":"Starship Engineer","compatibility":{"settings":["science_fiction"],"eras":["future"],"species":["human"],"life_stages":["young_adult","adult","mature","older"],"countries":[]},"metadata":{"education":["degree","apprenticeship"],"income_band":"upper_middle","role":"employed","technology_start":2050}},
  {"id":"habitat_ecologist","name":"Habitat Ecologist","compatibility":{"settings":["science_fiction"],"eras":["future"],"species":["human"],"life_stages":["young_adult","adult","mature","older"],"countries":[]},"metadata":{"education":["degree"],"income_band":"upper_middle","role":"employed","technology_start":2050}},
  {"id":"cartographer","name":"Cartographer","compatibility":{"settings":["fantasy","science_fiction"],"eras":["medieval_inspired","timeless","future"],"species":[],"life_stages":["young_adult","adult","mature","older"],"countries":[]},"metadata":{"education":["apprenticeship","degree"],"income_band":"moderate","role":"employed"}},
  {"id":"merchant","name":"Independent Merchant","compatibility":{"settings":["modern","fantasy","science_fiction"],"eras":[],"species":[],"life_stages":["young_adult","adult","mature","older"],"countries":[]},"metadata":{"education":["self_taught","apprenticeship"],"income_band":"moderate","role":"self_employed","category":"commerce","specialisation":"trade"}},
  {"id":"community_mediator","name":"Community Mediator","compatibility":{"settings":["modern","fantasy","science_fiction"],"eras":[],"species":[],"life_stages":["young_adult","adult","mature","older"],"countries":[]},"metadata":{"income_band":"moderate","role":"employed","category":"public_service","specialisation":"conflict_resolution"}},
  {"id":"materials_researcher","name":"Materials Researcher","compatibility":{"settings":["modern","science_fiction"],"eras":["modern","future"],"species":[],"life_stages":["young_adult","adult","mature","older"],"countries":[]},"metadata":{"education":["degree"],"income_band":"upper_middle","role":"employed","category":"science","specialisation":"materials"}},
  {"id":"shipwright","name":"Shipwright","compatibility":{"settings":["fantasy","science_fiction"],"eras":["medieval_inspired","timeless","future"],"species":[],"life_stages":["young_adult","adult","mature","older"],"countries":[]},"metadata":{"education":["apprenticeship"],"income_band":"moderate","role":"employed","category":"craft","specialisation":"maritime_construction"}},
  {"id":"care_worker","name":"Care Worker","compatibility":{"settings":["modern","science_fiction"],"eras":["modern","future"],"species":[],"life_stages":["young_adult","adult","mature","older"],"countries":[]},"metadata":{"education":["professional_training"],"income_band":"lower_middle","role":"employed","category":"care","specialisation":"community_support"}},
  {"id":"water_systems_technician","name":"Water Systems Technician","compatibility":{"settings":["modern","science_fiction"],"eras":["modern","future"],"species":[],"life_stages":["young_adult","adult","mature","older"],"countries":[]},"metadata":{"education":["apprenticeship","professional_training"],"income_band":"moderate","role":"employed","category":"infrastructure","specialisation":"water"}},
  {"id":"scribe","name":"Scribe","compatibility":{"settings":["fantasy"],"eras":["medieval_inspired","timeless"],"species":[],"life_stages":["young_adult","adult","mature","older"],"countries":[]},"metadata":{"education":["apprenticeship"],"income_band":"lower_middle","role":"employed","category":"knowledge","specialisation":"records"}},
  {"id":"courier","name":"Courier","compatibility":{"settings":["modern","fantasy","science_fiction"],"eras":[],"species":[],"life_stages":["young_adult","adult","mature","older"],"countries":[]},"metadata":{"education":["self_taught"],"income_band":"lower_middle","role":"self_employed","category":"logistics","specialisation":"delivery"}},
  {"id":"habitat_cook","name":"Habitat Cook","compatibility":{"settings":["science_fiction"],"eras":["future"],"species":[],"life_stages":["young_adult","adult","mature","older"],"countries":[]},"metadata":{"education":["apprenticeship","self_taught"],"income_band":"moderate","role":"employed","category":"hospitality","specialisation":"closed_loop_cuisine"}},
  {"id":"market_gardener","name":"Market Gardener","compatibility":{"settings":["modern","fantasy","science_fiction"],"eras":[],"species":[],"life_stages":["young_adult","adult","mature","older"],"countries":[]},"metadata":{"education":["self_taught","apprenticeship"],"income_band":"lower_middle","role":"self_employed","category":"agriculture","specialisation":"small_scale_growing"}}
]
