[
  {"id":"shared_flat","name":"Shared flat","compatibility":{"settings":["modern"],"eras":["modern"],"species":["human"],"life_stages":["young_adult","adult"],"countries":[]},"metadata":{"income_bands":["low","lower_middle","moderate"]}},
  {"id":"small_apartment","name":"Small apartment","compatibility":{"settings":["modern","science_fiction"],"eras":["modern","future"],"species":[],"life_stages":["young_adult","adult","mature","older"],"countries":[]},"metadata":{"income_bands":["lower_middle","moderate","upper_middle"]}},
  {"id":"family_house","name":"Family house","compatibility":{"settings":["modern"],"eras":["modern"],"species":["human"],"life_stages":["adult","mature","older"],"countries":[]},"metadata":{"income_bands":["moderate","upper_middle","high"]}},
  {"id":"village_cottage","name":"Village cottage","compatibility":{"settings":["fantasy"],"eras":["medieval_inspired","timeless"],"species":[],"life_stages":["young_adult","adult","mature","older"],"countries":[]},"metadata":{"income_bands":["low","lower_middle","moderate"]}}
  ,{"id":"family_home","name":"Family home","compatibility":{"settings":[],"eras":[],"species":[],"life_stages":["child","teen"],"countries":[]},"metadata":{"income_bands":["low","lower_middle","moderate","upper_middle","high"]}},
  {"id":"studio_flat","name":"Compact studio flat","compatibility":{"settings":["modern"],"eras":["modern"],"species":["human"],"life_stages":["young_adult","adult","mature","older"],"countries":[]},"metadata":{"income_bands":["low","lower_middle","moderate"]}},
  {"id":"terraced_house","name":"Terraced house","compatibility":{"settings":["modern"],"eras":["modern"],"species":["human"],"life_stages":["young_adult","adult","mature","older"],"countries":[]},"metadata":{"income_bands":["moderate","upper_middle","high"]}},
  {"id":"rural_farmhouse","name":"Rural farmhouse","compatibility":{"settings":["modern","fantasy"],"eras":[],"species":[],"life_stages":["young_adult","adult","mature","older"],"countries":[]},"metadata":{"income_bands":["lower_middle","moderate","upper_middle"]}},
  {"id":"rooms_above_shop","name":"Rooms above a busy shop","compatibility":{"settings":["modern","fantasy"],"eras":["modern","medieval_inspired","timeless"],"species":[],"life_stages":["young_adult","adult","mature","older"],"countries":[]},"metadata":{"income_bands":["low","lower_middle","moderate"]}},
  {"id":"guild_dormitory","name":"Guild dormitory","compatibility":{"settings":["fantasy"],"eras":["medieval_inspired","timeless"],"species":[],"life_stages":["teen","young_adult","adult"],"countries":[]},"metadata":{"income_bands":["low","lower_middle","moderate"]}},
  {"id":"woodland_lodge","name":"Secluded woodland lodge","compatibility":{"settings":["fantasy"],"eras":["medieval_inspired","timeless"],"species":[],"life_stages":["young_adult","adult","mature","older"],"countries":[]},"metadata":{"income_bands":["lower_middle","moderate","upper_middle"]}},
  {"id":"orbital_hab_pod","name":"Private orbital habitat pod","compatibility":{"settings":["science_fiction"],"eras":["future"],"species":["human"],"life_stages":["young_adult","adult","mature","older"],"countries":[]},"metadata":{"income_bands":["lower_middle","moderate","upper_middle"]}},
  {"id":"cooperative_habitat","name":"Cooperative habitat suite","compatibility":{"settings":["science_fiction"],"eras":["future"],"species":["human"],"life_stages":["young_adult","adult","mature","older"],"countries":[]},"metadata":{"income_bands":["low","lower_middle","moderate"]}}
]
