[
  {"id":"amelia","name":"Amelia","compatibility":{"settings":["modern"],"eras":["modern"],"species":["human"],"life_stages":[],"countries":["country_united_kingdom"]},"metadata":{"gender":"female"}},
  {"id":"oliver","name":"Oliver","compatibility":{"settings":["modern"],"eras":["modern"],"species":["human"],"life_stages":[],"countries":["country_united_kingdom"]},"metadata":{"gender":"male"}},
  {"id":"aiko","name":"Aiko","compatibility":{"settings":["modern"],"eras":["modern"],"species":["human"],"life_stages":[],"countries":["country_japan"]},"metadata":{"gender":"female"}},
  {"id":"haruto","name":"Haruto","compatibility":{"settings":["modern"],"eras":["modern"],"species":["human"],"life_stages":[],"countries":["country_japan"]},"metadata":{"gender":"male"}},
  {"id":"lucas","name":"Lucas","compatibility":{"settings":["modern"],"eras":["modern"],"species":["human"],"life_stages":[],"countries":["country_brazil"]},"metadata":{"gender":"male"}},
  {"id":"marina","name":"Marina","compatibility":{"settings":["modern"],"eras":["modern"],"species":["human"],"life_stages":[],"countries":["country_brazil"]},"metadata":{"gender":"female"}},
  {"id":"aerin","name":"Aerin","compatibility":{"settings":["fantasy"],"eras":[],"species":["elf"],"life_stages":[],"countries":[]},"metadata":{"gender":"neutral"}}
  ,{"id":"tomas_eldorian","name":"Tomas","compatibility":{"settings":["fantasy"],"eras":["medieval_inspired"],"species":["human"],"life_stages":[],"countries":[]},"metadata":{"gender":"male"}}
  ,{"id":"nova","name":"Nova","compatibility":{"settings":["science_fiction"],"eras":["future"],"species":["human"],"life_stages":[],"countries":[]},"metadata":{"gender":"neutral"}},
  {"id":"imogen","name":"Imogen","compatibility":{"settings":["modern"],"eras":["modern"],"species":["human"],"life_stages":[],"countries":["country_united_kingdom"]},"metadata":{"gender":"female"}},
  {"id":"theo","name":"Theo","compatibility":{"settings":["modern"],"eras":["modern"],"species":["human"],"life_stages":[],"countries":["country_united_kingdom"]},"metadata":{"gender":"male"}},
  {"id":"rowan","name":"Rowan","compatibility":{"settings":["modern"],"eras":["modern"],"species":["human"],"life_stages":[],"countries":["country_united_kingdom"]},"metadata":{"gender":"neutral"}},
  {"id":"mei","name":"Mei","compatibility":{"settings":["modern"],"eras":["modern"],"species":["human"],"life_stages":[],"countries":["country_japan"]},"metadata":{"gender":"female"}},
  {"id":"ren","name":"Ren","compatibility":{"settings":["modern"],"eras":["modern"],"species":["human"],"life_stages":[],"countries":["country_japan"]},"metadata":{"gender":"neutral"}},
  {"id":"daichi","name":"Daichi","compatibility":{"settings":["modern"],"eras":["modern"],"species":["human"],"life_stages":[],"countries":["country_japan"]},"metadata":{"gender":"male"}},
  {"id":"beatriz","name":"Beatriz","compatibility":{"settings":["modern"],"eras":["modern"],"species":["human"],"life_stages":[],"countries":["country_brazil"]},"metadata":{"gender":"female"}},
  {"id":"rafael","name":"Rafael","compatibility":{"settings":["modern"],"eras":["modern"],"species":["human"],"life_stages":[],"countries":["country_brazil"]},"metadata":{"gender":"male"}},
  {"id":"ariel_brazil","name":"Ariel","compatibility":{"settings":["modern"],"eras":["modern"],"species":["human"],"life_stages":[],"countries":["country_brazil"]},"metadata":{"gender":"neutral"}},
  {"id":"lyrien","name":"Lyrien","compatibility":{"settings":["fantasy"],"eras":["medieval_inspired","timeless"],"species":["elf"],"life_stages":[],"countries":[]},"metadata":{"gender":"female"}},
  {"id":"theron","name":"Theron","compatibility":{"settings":["fantasy"],"eras":["medieval_inspired","timeless"],"species":["elf"],"life_stages":[],"countries":[]},"metadata":{"gender":"male"}},
  {"id":"sael","name":"Sael","compatibility":{"settings":["fantasy"],"eras":["medieval_inspired","timeless"],"species":["elf"],"life_stages":[],"countries":[]},"metadata":{"gender":"neutral"}},
  {"id":"mira_eldorian","name":"Mira","compatibility":{"settings":["fantasy"],"eras":["medieval_inspired","timeless"],"species":["human"],"life_stages":[],"countries":[]},"metadata":{"gender":"female"}},
  {"id":"jonan","name":"Jonan","compatibility":{"settings":["fantasy"],"eras":["medieval_inspired","timeless"],"species":["human"],"life_stages":[],"countries":[]},"metadata":{"gender":"male"}},
  {"id":"quinn_orbital","name":"Quinn","compatibility":{"settings":["science_fiction"],"eras":["future"],"species":["human"],"life_stages":[],"countries":[]},"metadata":{"gender":"neutral"}},
  {"id":"sana_orbital","name":"Sana","compatibility":{"settings":["science_fiction"],"eras":["future"],"species":["human"],"life_stages":[],"countries":[]},"metadata":{"gender":"female"}},
  {"id":"elias_orbital","name":"Elias","compatibility":{"settings":["science_fiction"],"eras":["future"],"species":["human"],"life_stages":[],"countries":[]},"metadata":{"gender":"male"}},
  {"id":"nia_uk","name":"Nia","compatibility":{"settings":["modern"],"eras":["modern"],"species":["human"],"life_stages":[],"countries":["country_united_kingdom"]},"metadata":{"gender":"female"}},
  {"id":"idris_uk","name":"Idris","compatibility":{"settings":["modern"],"eras":["modern"],"species":["human"],"life_stages":[],"countries":["country_united_kingdom"]},"metadata":{"gender":"male"}},
  {"id":"hinata","name":"Hinata","compatibility":{"settings":["modern"],"eras":["modern"],"species":["human"],"life_stages":[],"countries":["country_japan"]},"metadata":{"gender":"neutral"}},
  {"id":"yui","name":"Yui","compatibility":{"settings":["modern"],"eras":["modern"],"species":["human"],"life_stages":[],"countries":["country_japan"]},"metadata":{"gender":"female"}},
  {"id":"caio","name":"Caio","compatibility":{"settings":["modern"],"eras":["modern"],"species":["human"],"life_stages":[],"countries":["country_brazil"]},"metadata":{"gender":"male"}},
  {"id":"luana","name":"Luana","compatibility":{"settings":["modern"],"eras":["modern"],"species":["human"],"life_stages":[],"countries":["country_brazil"]},"metadata":{"gender":"female"}},
  {"id":"elowen","name":"Elowen","compatibility":{"settings":["fantasy"],"eras":["medieval_inspired","timeless"],"species":[],"life_stages":[],"countries":[]},"metadata":{"gender":"female"}},
  {"id":"corin","name":"Corin","compatibility":{"settings":["fantasy"],"eras":["medieval_inspired","timeless"],"species":[],"life_stages":[],"countries":[]},"metadata":{"gender":"male"}},
  {"id":"vesper","name":"Vesper","compatibility":{"settings":["fantasy","science_fiction"],"eras":["timeless","future"],"species":[],"life_stages":[],"countries":[]},"metadata":{"gender":"neutral"}},
  {"id":"amara_orbital","name":"Amara","compatibility":{"settings":["science_fiction"],"eras":["future"],"species":[],"life_stages":[],"countries":[]},"metadata":{"gender":"female"}},
  {"id":"talin_orbital","name":"Talin","compatibility":{"settings":["science_fiction"],"eras":["future"],"species":[],"life_stages":[],"countries":[]},"metadata":{"gender":"male"}},
  {"id":"io_orbital","name":"Io","compatibility":{"settings":["science_fiction"],"eras":["future"],"species":[],"life_stages":[],"countries":[]},"metadata":{"gender":"neutral"}},
  {"id":"maren","name":"Maren","compatibility":{"settings":[],"eras":[],"species":[],"life_stages":[],"countries":[]},"metadata":{"gender":"female"}},
  {"id":"ash","name":"Ash","compatibility":{"settings":[],"eras":[],"species":[],"life_stages":[],"countries":[]},"metadata":{"gender":"neutral"}}
]
