[
  {"id":"observant","name":"Observant","tags":["perceptive"],"compatibility":{"settings":[],"eras":[],"species":[],"life_stages":[],"countries":[]},"metadata":{"cluster":"perception","complements":["patient","independent"],"contrasts":["playful"]}},
  {"id":"patient","name":"Patient","tags":["calm"],"compatibility":{"settings":[],"eras":[],"species":[],"life_stages":[],"countries":[]},"metadata":{"cluster":"temperament"}},
  {"id":"independent","name":"Independent","compatibility":{"settings":[],"eras":[],"species":[],"life_stages":["young_adult","adult","mature","older"],"countries":[]},"metadata":{"cluster":"autonomy"}},
  {"id":"playful","name":"Playful","compatibility":{"settings":[],"eras":[],"species":[],"life_stages":[],"countries":[]},"metadata":{"cluster":"humour"}},
  {"id":"ambitious","name":"Ambitious","compatibility":{"settings":[],"eras":[],"species":[],"life_stages":["teen","young_adult","adult","mature"],"countries":[]},"metadata":{"cluster":"drive"}},
  {"id":"compassionate","name":"Compassionate","compatibility":{"settings":[],"eras":[],"species":[],"life_stages":[],"countries":[]},"metadata":{"cluster":"empathy"}},
  {"id":"resourceful","name":"Resourceful","compatibility":{"settings":[],"eras":[],"species":[],"life_stages":["teen","young_adult","adult","mature","older"],"countries":[]},"metadata":{"cluster":"adaptability","complements":["observant","pragmatic"],"contrasts":["idealistic"]}},
  {"id":"pragmatic","name":"Pragmatic","compatibility":{"settings":[],"eras":[],"species":[],"life_stages":["young_adult","adult","mature","older"],"countries":[]},"metadata":{"cluster":"reasoning","complements":["resourceful","decisive"],"contrasts":["dreamy"]}},
  {"id":"idealistic","name":"Idealistic","compatibility":{"settings":[],"eras":[],"species":[],"life_stages":["teen","young_adult","adult","mature"],"countries":[]},"metadata":{"cluster":"worldview","complements":["compassionate","ambitious"],"contrasts":["pragmatic"]}},
  {"id":"diplomatic","name":"Diplomatic","compatibility":{"settings":[],"eras":[],"species":[],"life_stages":["young_adult","adult","mature","older"],"countries":[]},"metadata":{"cluster":"social","complements":["patient","compassionate"],"contrasts":["blunt"]}},
  {"id":"decisive","name":"Decisive","compatibility":{"settings":[],"eras":[],"species":[],"life_stages":["young_adult","adult","mature","older"],"countries":[]},"metadata":{"cluster":"drive","complements":["pragmatic","independent"],"contrasts":["reflective"]}},
  {"id":"reflective","name":"Reflective","compatibility":{"settings":[],"eras":[],"species":[],"life_stages":["teen","young_adult","adult","mature","older"],"countries":[]},"metadata":{"cluster":"introspection","complements":["observant","patient"],"contrasts":["decisive"]}},
  {"id":"sociable","name":"Sociable","compatibility":{"settings":[],"eras":[],"species":[],"life_stages":[],"countries":[]},"metadata":{"cluster":"social","complements":["playful","compassionate"],"contrasts":["independent"]}},
  {"id":"methodical","name":"Methodical","compatibility":{"settings":[],"eras":[],"species":[],"life_stages":["teen","young_adult","adult","mature","older"],"countries":[]},"metadata":{"cluster":"organisation","complements":["patient","observant"],"contrasts":["spontaneous"]}},
  {"id":"spontaneous","name":"Spontaneous","compatibility":{"settings":[],"eras":[],"species":[],"life_stages":["teen","young_adult","adult","mature","older"],"countries":[]},"metadata":{"cluster":"adaptability","complements":["playful","resourceful"],"contrasts":["methodical"]}},
  {"id":"dry_witted","name":"Dry-witted","compatibility":{"settings":[],"eras":[],"species":[],"life_stages":["teen","young_adult","adult","mature","older"],"countries":[]},"metadata":{"cluster":"humour","complements":["observant","independent"],"contrasts":["earnest"]}}
]
