[
  {"id":"cream_jacket_charcoal_trousers","name":"Cream cropped jacket, charcoal trousers, black ankle boots, and silver pendant","compatibility":{"settings":["modern"],"eras":["modern"],"species":["human"],"life_stages":["young_adult","adult"],"countries":[]},"metadata":{"style":"minimal_smart_casual"}},
  {"id":"denim_overshirt_cargo_trousers","name":"Faded denim overshirt, dark tee, cargo trousers, and worn trainers","compatibility":{"settings":["modern"],"eras":["modern"],"species":["human"],"life_stages":["teen","young_adult","adult","mature"],"countries":[]},"metadata":{"style":"practical_layered"}},
  {"id":"forest_cloak_linen_layers","name":"Moss-green cloak over layered linen with weathered leather boots","compatibility":{"settings":["fantasy"],"eras":["medieval_inspired","timeless"],"species":[],"life_stages":[],"countries":[]},"metadata":{"style":"practical_layered"}}
  ,{"id":"comfortable_everyday_layers","name":"Comfortable everyday layers with practical shoes and a favourite small accessory","compatibility":{"settings":[],"eras":[],"species":[],"life_stages":["child","teen"],"countries":[]},"metadata":{"style":"practical_layered"}}
  ,{"id":"utility_jacket_adaptive_trousers","name":"Streamlined utility jacket, adaptive trousers, and magnetic-soled boots","compatibility":{"settings":["science_fiction"],"eras":["future"],"species":["human"],"life_stages":["young_adult","adult","mature","older"],"countries":[]},"metadata":{"style":"practical_layered"}}
  ,{"id":"near_future_smart_layers","name":"Clean technical overshirt, tailored stretch trousers, and understated smart shoes","compatibility":{"settings":["modern"],"eras":["future"],"species":["human"],"life_stages":["young_adult","adult","mature","older"],"countries":[]},"metadata":{"style":"minimal_smart_casual"}}
  ,{"id":"timeless_knit_tailored_trousers","name":"Fine knit top, tailored trousers, comfortable leather shoes, and a well-kept coat","compatibility":{"settings":["modern"],"eras":["modern"],"species":["human"],"life_stages":["adult","mature","older"],"countries":[]},"metadata":{"style":"minimal_smart_casual"}},
  {"id":"canvas_jacket_work_boots","name":"Ochre canvas jacket, striped cotton shirt, dark jeans, and sturdy work boots","compatibility":{"settings":["modern"],"eras":["modern"],"species":["human"],"life_stages":["young_adult","adult","mature","older"],"countries":[]},"metadata":{"style":"relaxed_workwear"}},
  {"id":"printed_shirt_corduroy","name":"Bold printed shirt, rust corduroy trousers, white trainers, and a vintage watch","compatibility":{"settings":["modern"],"eras":["modern"],"species":["human"],"life_stages":["teen","young_adult","adult","mature"],"countries":[]},"metadata":{"style":"colourful_vintage"}},
  {"id":"navy_blazer_wool_trousers","name":"Navy blazer, fine roll-neck, tailored wool trousers, and polished loafers","compatibility":{"settings":["modern"],"eras":["modern"],"species":["human"],"life_stages":["young_adult","adult","mature","older"],"countries":[]},"metadata":{"style":"tailored_classic"}},
  {"id":"waxed_jacket_hiking_boots","name":"Weathered waxed jacket, flannel shirt, utility trousers, and hiking boots","compatibility":{"settings":["modern"],"eras":["modern"],"species":["human"],"life_stages":["teen","young_adult","adult","mature","older"],"countries":[]},"metadata":{"style":"outdoors_practical"}},
  {"id":"dyed_tunic_tool_belt","name":"Indigo-dyed tunic, layered apron, tool belt, wrapped trousers, and soft leather boots","compatibility":{"settings":["fantasy"],"eras":["medieval_inspired","timeless"],"species":[],"life_stages":["teen","young_adult","adult","mature","older"],"countries":[]},"metadata":{"style":"artisan_layers"}},
  {"id":"charcoal_doublet_silver_clasp","name":"Charcoal doublet, slate cloak with a silver clasp, fitted trousers, and high leather boots","compatibility":{"settings":["fantasy"],"eras":["medieval_inspired","timeless"],"species":[],"life_stages":["young_adult","adult","mature","older"],"countries":[]},"metadata":{"style":"courtly_understated"}},
  {"id":"ranger_green_layers","name":"Fern-green overshirt, reinforced brown trousers, weather cloak, and trail-worn boots","compatibility":{"settings":["fantasy"],"eras":["medieval_inspired","timeless"],"species":[],"life_stages":["teen","young_adult","adult","mature","older"],"countries":[]},"metadata":{"style":"outdoors_practical"}},
  {"id":"graphite_seamless_suit","name":"Graphite seamless jacket, pale technical knit, tapered adaptive trousers, and low-profile boots","compatibility":{"settings":["science_fiction"],"eras":["future"],"species":["human"],"life_stages":["young_adult","adult","mature","older"],"countries":[]},"metadata":{"style":"technical_minimalist"}},
  {"id":"orange_utility_vest","name":"Burnt-orange utility vest, pressure-rated base layers, cargo trousers, and magnetic work boots","compatibility":{"settings":["science_fiction"],"eras":["future"],"species":["human"],"life_stages":["teen","young_adult","adult","mature","older"],"countries":[]},"metadata":{"style":"orbital_utility"}},
  {"id":"silver_ceremonial_layers","name":"Pearl-grey formal layers, asymmetric silver sash, slim boots, and a translucent data brooch","compatibility":{"settings":["science_fiction"],"eras":["future"],"species":["human"],"life_stages":["young_adult","adult","mature","older"],"countries":[]},"metadata":{"style":"technical_minimalist"}}
]
